,text,set_name,level,script_calc_level,script_calc_level_int,level_difference
2887,"Mr. Darling had sometimes a feeling that Nana did not admire him. ""I know she admires you tremendously, George,"" Mrs. Darling would assure him, and then she would sign to the children to be specially nice to father. Lovely dances followed, in which the only other servant, Liza, was sometimes allowed to join. Such a midget she looked in her long skirt and maid's cap, though she had sworn, when engaged, that she would never be ten again. The gaiety of those romps! And gayest of all was Mrs. Darling, who would pirouette so wildly that all you could see of her was the kiss, and then if you had dashed at her you might have got it. There never was a simpler happier family until the coming of Peter Pan.",peter pan part 1,2,Advanced,4,2
2890,"Of course the Neverlands vary a good deal. John's, for instance, had a lagoon with flamingoes flying over it at which John was shooting, while Michael, who was very small, had a flamingo with lagoons flying over it. John lived in a boat turned upside down on the sands, Michael in a wigwam, Wendy in a house of leaves deftly sewn together. John had no friends, Michael had friends at night, Wendy had a pet wolf forsaken by its parents, but on the whole the Neverlands have a family resemblance, and if they stood still in a row you could say of them that they have each other's nose, and so forth. On these magic shores children at play are for ever beaching their coracles. We too have been there; we can still hear the sound of the surf, though we shall land no more.",peter pan part 1,2,Advanced,4,2
2891,"Of all delectable islands the Neverland is the snuggest and most compact, not large and sprawly, you know, with tedious distances between one adventure and another, but nicely crammed. When you play at it by day with the chairs and table-cloth, it is not in the least alarming, but in the two minutes before you go to sleep it becomes very real. That is why there are night-lights.
Occasionally in her travels through her children's minds Mrs. Darling found things she could not understand, and of these quite the most perplexing was the word Peter. She knew of no Peter, and yet he was in children's minds. The name stood out in bolder letters than any of the other words, and as Mrs. Darling gazed she felt that it had an oddly cocky appearance.",peter pan part 1,2,Advanced,4,2
2892,"At first Mrs. Darling did not know, but after thinking back into her childhood she just remembered a Peter Pan who was said to live with the fairies. There were odd stories about him, as that when children died he went part of the way with them, so that they should not be frightened.
She had believed in him at the time, but now that she was married and full of sense she quite doubted whether there was any such person.
""Besides,"" she said to Wendy, ""he would be grown up by this time.""
""Oh no, he isn't grown up,"" Wendy assured her confidently, ""and he is just my size.""
Mrs. Darling consulted Mr. Darling, but he smiled pooh-pooh.
""Mark my words,"" he said, ""it is some nonsense Nana has been putting into their heads; just the sort of idea a dog would have. Leave it alone, and it will blow over.""",peter pan part 1,2,Advanced,4,2
2893,"Children have the strangest adventures without being troubled by them. For instance, they may remember to mention, a week after the event happened, that when they were in the wood they had met their father and had a game with him. It was in this casual way that Wendy one morning made a disquieting revelation. Some leaves of a tree had been found on the nursery floor, which certainly were not there when the children went to bed, and Mrs. Darling was puzzling over them when Wendy said with a tolerant smile: ""I do believe it is that Peter again!""
""Whatever do you mean, Wendy?""
""It is so naughty of him not to wipe his feet,"" Wendy said, sighing. She was a tidy child and didn't like when Peter did such things.",peter pan part 1,2,Advanced,4,2
2895,"On the night we speak of all the children were once more in bed. It happened to be Nana's evening off, and Mrs. Darling had bathed them and sung to them till one by one they had let go her hand and slid away into the land of sleep. All were looking so safe and cosy that she smiled at her fears now and sat down tranquilly by the fire to sew.
It was something for Michael, who on his birthday was getting into shirts. The fire was warm, however, and the nursery dimly lit by three night-lights, and presently the sewing lay on Mrs. Darling's lap. Then her head nodded, oh, so gracefully. She was asleep. Look at the four of them, Wendy and Michael over there, John here, and Mrs. Darling by the fire. There should have been a fourth night-light.",peter pan part 1,2,Advanced,4,2
2896,"While Mrs. Darling slept she had a dream. She dreamt that the Neverland had come too near and that a strange boy had broken through from it. He did not alarm her, for she thought she had seen him before in the faces of many women who have no children. Perhaps he is to be found in the faces of some mothers also.
But in her dream he had rent the film that obscures the Neverland, and she saw Wendy and John and Michael peeping through the gap.
The dream by itself would have been a trifle, but while she was dreaming the window of the nursery blew open, and a boy did drop on the floor. He was accompanied by a strange light, no bigger than your fist, which darted about the room like a living thing and I think it must have been this light that wakened Mrs. Darling.",peter pan part 1,2,Advanced,4,2
2903,"The way Mr. Darling won his wife was this: the many gentlemen who had been boys when she was a girl discovered simultaneously that they loved her, and they all ran to her house to propose to her except Mr. Darling, who took a cab and nipped in first, and so he got her.",peter pan part 1,2,Advanced,4,2
2907,"John's had a lagoon with flamingoes flying over it at which John was shooting, while Michael, who was very small, had a flamingo with lagoons flying over it. John lived in a boat turned upside down on the sands, Michael in a wigwam, Wendy in a house of leaves deftly sewn together.",peter pan part 1,2,Advanced,4,2
2909,"Children have the strangest adventures without being troubled by them. For instance, they may remember to mention, a week after the event happened, that when they were in the wood they had met their father and had a game with him.",peter pan part 1,2,Advanced,4,2
2911,Mrs. Darling had bathed them and sung to them till one by one they had let go her hand and slid away into the land of sleep. All were looking so safe and cosy that she smiled at her fears now and sat down tranquilly by the fire to sew.,peter pan part 1,2,Advanced,4,2
2914,"She returned to the nursery, and found Nana with something in her mouth, which proved to be the boy's shadow. As he leapt at the window Nana had closed it quickly, too late to catch him, but his shadow had not had time to get out.",peter pan part 1,2,Advanced,4,2
2916,"They would sit there in the empty nursery, recalling every smallest detail of that dreadful evening. It had begun so precisely like a hundred other evenings, with Nana putting on the water for Michael's bath and carrying him to it on her back.",peter pan part 1,2,Advanced,4,2
2918,"Lovely dances followed, in which the only other servant, Liza, was sometimes allowed to join. Such a midget she looked in her long skirt and maid's cap, though she had sworn, when engaged, that she would never be ten again.",peter pan part 1,2,Advanced,4,2
2919,"Children have the strangest adventures without being troubled by them. For instance, they may remember to mention, a week after the event happened, that when they were in the wood they had met their father and had a game with him.",peter pan part 1,2,Advanced,4,2
2921,"John was saying: ""I am happy to inform you, Mrs. Darling, that you are now a mother,"" in just such a tone as Mr. Darling himself may have used on the real occasion. Wendy had danced with joy, just as the real Mrs. Darling must have done.",peter pan part 1,2,Advanced,4,2
2926,"""Tinker Bell,"" Peter called softly, after making sure that the children were asleep, ""Tink, where are you?"" She was in a jug for the moment, and liking it extremely; she had never been in a jug before.
""Oh, do come out of that jug, and tell me, do you know where they put my shadow?""
The loveliest tinkle as of golden bells answered him. It is the fairy language. You ordinary children can never hear it, but if you were to hear it you would know that you had heard it once before.
Tink said that the shadow was in the big box. She meant the chest of drawers, and Peter jumped at the drawers, scattering their contents to the floor with both hands, as kings toss happence to the crowd. In a moment he had recovered his shadow, and in his delight he forgot that he had shut Tinker Bell up in the drawer.",peter pan part 2,2,Advanced,4,2
2929,"Wendy saw the shadow on the floor, looking so draggled, and she was frightfully sorry for Peter. ""How awful!"" she said, but she could not help smiling when she saw that he had been trying to stick it on with soap. How exactly like a boy!
Fortunately she knew at once what to do. ""It must be sewn on,"" she said, just a little patronisingly.
""What's sewn?"" he asked.
""You're dreadfully ignorant.""
""No, I'm not.""
But she was exulting in his ignorance. ""I shall sew it on for you, my little man,"" she said, though he was tall as herself, and she got out her housewife sewing bag, and sewed the shadow on to Peter's foot.
""I daresay it will hurt a little,"" she warned him.
""Oh, I shan't cry,"" said Peter, who was already of the opinion that he had never cried in his life.",peter pan part 2,2,Advanced,4,2
2930,"Peter clenched his teeth and did not cry while Wendy was sewing it on, and soon his shadow was behaving properly, though still a little creased.
""Perhaps I should have ironed it,"" Wendy said thoughtfully, but Peter, boylike, was indifferent to appearances, and he was now jumping about in the wildest glee. Alas, he had already forgotten that he owed his bliss to Wendy. He thought he had attached the shadow himself.
""How clever I am!"" he crowed rapturously, ""oh, the cleverness of me!""
It is humiliating to have to confess that this conceit of Peter was one of his most fascinating qualities.
But for the moment Wendy was shocked.
""You conceit braggart,"" she exclaimed, with frightful sarcasm; ""of course I did nothing!""
""You did a little,"" Peter said carelessly, and continued to dance.",peter pan part 2,2,Advanced,4,2
2936,"""Oh, how lovely to fly.""
""I'll teach you how to jump on the wind's back, and then away we go.""
""Oo!"" she exclaimed rapturously.
""Wendy, Wendy, when you are sleeping in your silly bed you might be flying about with me saying funny things to the stars.""
""Oo!""
""And, Wendy, there are mermaids.""
""Mermaids! With tails?""
""Such long tails.""
""Oh,"" cried Wendy, ""to see a mermaid!""
He had become frightfully cunning. ""Wendy,"" he said, ""how we should all respect you.""
She was wriggling her body in distress. It was quite as if she were trying to remain on the nursery floor.
But he had no pity for her.
""Wendy,"" he said, the sly one, ""you could tuck us in at night.""
""None of us has ever been tucked in at night. And you could darn our clothes, and make pockets for us. None of us has any pockets.""",peter pan part 2,2,Advanced,4,2
2938,"""Out with the light! Hide! Quick!"" cried John, taking command for the only time throughout the whole adventure. And thus when Liza entered, holding Nana, the nursery seemed quite its old self, very dark, and you would have sworn you heard its three wicked inmates breathing angelically as they slept. They were really doing it artfully from behind the window curtains.
Liza was in a bad temper, for she was mixing the Christmas puddings in the kitchen, and had been drawn from them, with a raisin still on her cheek, by Nana's absurd suspicions. She thought the best way of getting a little quiet was to take Nana to the nursery for a moment, but in custody of course.
""There, you suspicious brute,"" she said, not sorry that Nana was in disgrace. ""Everyone of the little angels sound asleep in bed.""",peter pan part 2,2,Advanced,4,2
2941,"""I've got it now, Wendy!"" cried John, but soon he found he had not. Not one of them could fly an inch, though even Michael was in words of two syllables, and Peter did not know A from Z.
Of course Peter had been trifling with them, for no one can fly unless the fairy dust has been blown on him. Fortunately, as we have mentioned, one of his hands was messy with it, and he blew some on each of them, with the most superb results.
""Now just wiggle your shoulders this way,"" he said, ""and let go.""
They were all on their beds, and gallant Michael let go first. He did not quite mean to let go, but he did it, and immediately he was borne across the room.
""I flewed!"" he screamed while still in mid-air.
John let go and met Wendy near the bathroom.",peter pan part 2,2,Advanced,4,2
2946,"Of course Peter had been trifling with them, for no one can fly unless the fairy dust has been blown on him. Fortunately, as we have mentioned, one of his hands was messy with it, and he blew some on each of them, with the most superb results.",peter pan part 2,2,Advanced,4,2
2949,"""Perhaps I should have ironed it,"" Wendy said thoughtfully, but Peter, boylike, was indifferent to appearances, and he was now jumping about in the wildest glee. Alas, he had already forgotten that he owed his bliss to Wendy.",peter pan part 2,2,Advanced,4,2
2950,"Liza was in a bad temper, for she was mixing the Christmas puddings in the kitchen, and had been drawn from them by Nana's absurd suspicions. She thought the best way of getting a little quiet was to take Nana to the nursery for a moment.",peter pan part 2,2,Advanced,4,2
2952,"It is a punishment put on them for something they did so long ago that no star now knows what it was. So the older ones have become glassy-eyed and seldom speak (winking is the star language), but the little ones still wonder.",peter pan part 2,2,Advanced,4,2
2958,"He had become frightfully cunning. ""Wendy,"" he said, ""how we should all respect you."" She was wriggling her body in distress. It was quite as if she were trying to remain on the nursery floor. But he had no pity for her.",peter pan part 2,2,Advanced,4,2
2961,They are the children who fall out of their perambulators when the nurse is looking the other way. If they are not claimed in seven days they are sent far away to the Neverland to defray expenses. I'm captain.,peter pan part 2,2,Advanced,4,2
2962,"Children were not nearly so elegant as Peter, they could not help kicking a little, but their heads were bobbing against the ceiling, and there is almost nothing so delicious as that. Peter gave Wendy a hand at first, but had to desist, Tink was so indignant.
Up and down they went, and round and round. Heavenly was Wendy's word.
""I say,"" cried John, ""why shouldn't we all go out?""
Of course it was to this that Peter had been luring them.
Michael was ready: he wanted to see how long it took him to do a billion miles. But Wendy hesitated.
""Mermaids!"" said Peter again.
""And there are pirates.""
""Pirates,"" cried John, seizing his Sunday hat, ""let us go at once.""
It was just at this moment that Mr. and Mrs. Darling hurried with Nana out of 27.",peter pan part 3,2,Advanced,4,2
2968,"Indeed children were constantly bumping. They could now fly strongly, though they still kicked far too much; but if they saw a cloud in front of them, the more they tried to avoid it, the more certainly did they bump into it. If Nana had been with them, she would have had a bandage round Michael's forehead by this time.
Peter was not with them for the moment, and they felt rather lonely up there by themselves.
He could go so much faster than they that he would suddenly shoot out of sight, to have some adventure in which they had no share. He would come down laughing over something fearfully funny he had been saying to a star, but he had already forgotten what it was, or he would come up with mermaid scales still sticking to him, and yet not be able to say for certain what had been happening.",peter pan part 3,2,Advanced,4,2
2971,"Peter's careless manner had gone at last, his eyes were sparkling, and a tingle went through them every time they touched his body. They were now over the fearsome island, flying so low that sometimes a tree grazed their feet. Nothing horrid was visible in the air, yet their progress had become slow and laboured, exactly as if they were pushing their way through hostile forces. Sometimes they hung in the air until Peter had beaten on it with his fists.
""They don't want us to land,"" he explained.
""Who are they?"" Wendy whispered, shuddering.
But he could not or would not say. Tinker Bell had been asleep on his shoulder, but now he wakened her and sent her on in front. Sometimes he poised himself in the air, listening intently, with his hand to his ear.",peter pan part 3,2,Advanced,4,2
2975,"Tink agreed to travel by hat if it was carried in the hand. John carried it, though she had hoped to be carried by Peter. Presently Wendy took the hat, because John said it struck against his knee as he flew; and this, as we shall see, led to mischief, for Tinker Bell hated to be under an obligation to Wendy.
In the black topper the light was completely hidden, and they flew on in silence. It was the stillest silence they had ever known, broken once by a distant lapping, which Peter explained was the wild beasts drinking at the ford, and again by a rasping sound that might have been the branches of trees rubbing together, but he said it was the redskins sharpening their knives.
Even these noises ceased. To Michael the loneliness was dreadful. ""If only something would make a sound!"" he cried.",peter pan part 3,2,Advanced,4,2
2976,"The air was rent by the most tremendous crash he had ever heard. The pirates had fired Long Tom at them. The roar of it echoed through the mountains, and the echoes seemed to cry savagely, ""Where are they, where are they, where are they?""
Thus sharply did the terrified three learn the difference between an island of make-believe and the same island come true.
When at last the heavens were steady again, John and Michael found themselves alone in the darkness. John was treading the air mechanically, and Michael without knowing how to float was floating.
""Are you shot?"" John whispered tremulously.
""I haven't tried myself out yet,"" Michael whispered back.
We know now that no one had been hit. Peter, however, had been carried by the wind of the shot far out to sea.",peter pan part 3,2,Advanced,4,2
2982,"Children were not nearly so elegant as Peter, they could not help kicking a little, but their heads were bobbing against the ceiling, and there is almost nothing so delicious as that. Peter gave Wendy a hand at first, but had to desist, Tink was so indignant.",peter pan part 3,2,Advanced,4,2
2983,"Will they reach the nursery in time? If so, how delightful for them, and we shall all breathe a sigh of relief, but there will be no story. On the other hand, if they are not in time, I solemnly promise that it will all come right in the end.",peter pan part 3,2,Advanced,4,2
2987,They recalled that not so long ago they had thought themselves fine fellows for being able to fly round a room. But how long ago? They were flying over the sea before this thought began to disturb Wendy seriously.,peter pan part 3,2,Advanced,4,2
2996,"They talked of Cinderella, and Tootles was confident that his mother must have been very like her. It was only in Peter's absence that they could speak of mothers, the subject being forbidden by him as silly.",peter pan part 3,2,Advanced,4,2
2998,"Peter's careless manner had gone at last, his eyes were sparkling, and a tingle went through them every time they touched his body. They were now over the fearsome island, flying so low that sometimes a tree grazed their feet.",peter pan part 3,2,Advanced,4,2
2999,"But he could not or would not say. Tinker Bell had been asleep on his shoulder, but now he woke her and sent her on in front. Sometimes he poised himself in the air, listening intently, with his hand to his ear.",peter pan part 3,2,Advanced,4,2
3009,"Wendy's favourite time for sewing and darning was after they had all gone to bed. Then, as she expressed it, she had a breathing time for herself; and she occupied it in making new things for them, and putting double pieces on the knees, for they were all most frightfully hard on their knees.
When she sat down to a basketful of their stockings, every heel with a hole in it, she would fling up her arms and exclaim, ""Oh dear, I am sure I sometimes think spinsters are to be envied!""
Her face beamed when she exclaimed this. You remember about her pet wolf. Well, it very soon discovered that she had come to the island and it found her out, and they just ran into each other's arms. After that it followed her about everywhere.",peter pan part 4,2,Advanced,4,2
3011,"Adventures, of course, as we shall see, were of daily occurrence; but about this time Peter invented, with Wendy's help, a new game that fascinated him enormously, until he suddenly had no more interest in it, which, as you have been told, was what always happened with his games. It consisted in pretending not to have adventures, in doing the sort of thing John and Michael had been doing all their lives, sitting on stools flinging balls in the air, pushing each other, going out for walks and coming back. To see Peter doing nothing on a stool was a great sight; he could not help looking solemn at such times, to sit still seemed to him such a comic thing to do. He boasted that he had gone walking for the good of his health. For several suns these were the most novel of all adventures to him.",peter pan part 4,2,Advanced,4,2
3013,"The extraordinary upshot of this adventure was – but we have not decided yet that this is the adventure we are to narrate. Perhaps a better one would be the night attack by the redskins on the house under the ground, when several of them stuck in the hollow trees and had to be pulled out like corks. Or we might tell how Peter saved Tiger Lily's life in the Mermaids' Lagoon, and so made her his ally. Or we could tell of that cake the pirates cooked so that the boys might eat it and perish; and how they placed it in one cunning spot after another; but always Wendy snatched it from the hands of her children, so that in time it lost its succulence, and became as hard as a stone, and was used as a missile, and Hook fell over it in the dark.",peter pan part 4,2,Advanced,4,2
3016,"The most haunting time at which to see mermaids is at the turn of the moon, when they utter strange wailing cries; but the lagoon is dangerous for mortals then, and until the evening of which we have now to tell, Wendy had never seen the lagoon by moonlight, less from fear, for of course Peter would have accompanied her, than because she had strict rules about everyone being in bed by seven. She was often at the lagoon, however, on sunny days after rain, when the mermaids come up in extraordinary numbers to play with their bubbles. The bubbles of many colours made in rainbow water they treat as balls, hitting them gaily from one to another with their tails, and trying to keep them in the rainbow till they burst.",peter pan part 4,2,Advanced,4,2
3017,"It was a day when they were all on Marooners' Rock. The rock was not much larger than their great bed, but of course they all knew how not to take up much room, and they were dozing, or at least lying with their eyes shut, and pinching occasionally when they thought Wendy was not looking. She was very busy, stitching.
While she stitched a change came to the lagoon. Little shivers ran over it, and the sun went away and shadows stole across the water, turning it cold. Wendy could no longer see to thread her needle, and when she looked up, the lagoon that had always still been such a laughing place seemed formidable and unfriendly. It was not, she knew, that night had come, but something as dark as night had come. No, worse than that.",peter pan part 4,2,Advanced,4,2
3019,"Great were the rejoicings when Peter reached the home under the ground almost as soon as Wendy, who had been carried hither and thither by the kite. Every boy had adventures to tell; but perhaps the biggest adventure of all was that they were several hours late for bed. This so inflated them that they did various dodgy things to get staying up still longer, such as demanding bandages; but Wendy, though glorying in having them all home again safe and sound, was scandalised by the lateness of the hour, and cried, ""To bed, to bed,"" in a voice that had to be obeyed. Next day, however, she was awfully tender, and gave out bandages to everyone, and they played till bed-time at limping about and carrying their arms in slings.",peter pan part 4,2,Advanced,4,2
3020,"One important result of the brush with the pirates on the lagoon was that it made the redskins their friends. Peter Pan had saved Tiger Lily from a dreadful fate, and now there was nothing she and her braves would not do for him. All night they sat above, keeping watch over the home under the ground and awaiting the big attack by the pirates which obviously could not be much longer delayed. Even by day they hung about, smoking the pipe of peace, and looking almost as if they wanted something to eat.
""Peter Pan save me, me his velly nice friend.""
She was far too pretty to cringe in this way, but Peter thought it his due, and he would answer condescendingly, ""It is good. Peter Pan has spoken.""",peter pan part 4,2,Advanced,4,2
